ID,ISSUE,PROPLetter,PROPTitle,Month,Day,Year,Date,Description,PASS_FAIL,Vote_Counts,Percent_Vote,Percent_Required_To_Pass,Kind,HowPlaced,Fullimage
1678,Newspaper,K,Selection of Official Newspapers,November,5,2002,05-Nov-02,Shall the City change the process and criteria for selection of official newspapers for publishing public notices?,F,"Yes: 71,756 No: 119,931",Yes: 37.43% No: 65.57%,50%+1,Ordinance,Board of Supervisors,November5_2002
1679,Taxes,L,Real Estate Tax,November,5,2002,05-Nov-02,"Shall the City increase its tax on the sale or transfer of real estate worth $1,000,000 or more from $3.75 to $7.50 for each $500 of value?",F,"Yes: 92,163 No: 113,902",Yes: 44.73% No: 55.27%,50%+1,Ordinance,Board of Supervisors,November5_2002
1680,Economy ,M,Economic Development,November,5,2002,05-Nov-02,Shall the City give new duties to its Office of Economic Development and shall the City use money from its business registration tax to promote economic and business development?,F,"Yes: 93,404 No: 98,127",Yes: 48.77% No: 51.23%,50%+1,Ordinance,Mayor,November5_2002
1681,Homeless,N,Adjusting Services and Payments to Homeless Individuals,November,5,2002,05-Nov-02,"Shall the City change the way it provides assistance to qualified homeless individuals by counting the value of housing, shelter and meal services as part of their cash benefit?",P,"Yes: 125,436 No: 84,433",Yes: 59.77% No: 40.23%,50%+1,Ordinance,Initiative,November5_2002
1682,Homeless,O,Conditions For Providing Services and Payments To Homeless Individuals,November,5,2002,05-Nov-02,"Shall the City create new housing and drug treatment programs, and shall the City meet certain conditions before counting the value of services provided to homeless individuals as part of their cash benefit?",F,"Yes: 98,341    No: 106,257",Yes: 48.07% No: 51.93%,50%+1,Ordinance,Board of Supervisors,November5_2002
1683,Utilities,P,Revenue Bond Oversight Committee,November,5,2002,05-Nov-02,"Shall the City create a committee to oversee its use of utility revenue bond funds, and report whether these funds are used for authorized purposes?",P,"Yes: 109,577  No:  83,843",Yes: 56.65% No: 43.35%,50%+1,Ordinance,Board of Supervisors,November5_2002
1684,Budget,Q,Use of City Funds,November,5,2002,05-Nov-02,"Shall the City prohibit recipients of City contracts, grants and loans from using City funds for political campaigns, and require at least ten audits each year to check for compliance?",P,"Yes: 131,117  No:  63,822",Yes: 67.26% No: 32.74%,50%+1,Ordinance,Mayor,November5_2002
1685,Housing,R,Condominium Conversion with Certain Conditions,November,5,2002,05-Nov-02,"Shall the City allow apartment buildings of any size to be converted to condominiums, and increase the number of units that can be converted each year, subject to certain tenant protections and certain planning exceptions?",F,"Yes: 82,089    No: 123,129",Yes: 40.00% No: 60.00%,50%+1,Ordinance,Initiative,November5_2002
1686,Health,S,Medical Marijuana,November,5,2002,05-Nov-02,Shall it be City policy to consider growing and distributing marijuana for medical use?,P,"Yes: 127,661  No:  78,181",Yes: 62.02% No: 37.98%,50%+1,Policy Declaration,Board of Supervisors,November5_2002
1687,Transportation,BB,BART Seismic Safety Bond,November,5,2002,05-Nov-02,"To protect public safety, preserve mobility for Bay Area residents and keep traffic moving in the event of a major earthquake, shall the San Francisco Bay Area Rapid Transit District be authorized to issue bonds not to exceed $1.05 billion to seismically retrofit, strengthen, improve, and replace BART facilities serving Alameda, Contra Costa, and San Francisco Counties, and establish an independent citizens' oversight committee to review and report bond expenditures to the public?",F,"Yes: 140,610  No:  52,167",Yes: 72.94% No: 27.06%,66 2/3%,District Bond Issue,(San Francisco Bay Area Rapid Transit District,November5_2002
1688,Education,A,School Bonds,November,4,2003,04-Nov-03,"Shall the San Francisco Unified School District repair and rehabilitate its facilities to current accessibility, health, safety and instructional standards, replace worn-out plumbing, electrical and other major building systems, replace aging heating, ventilation and air handling systems, renovate outdated classrooms and other training facilities, construct facilities to replace bungalows, by issuing $295 million in bonds, at legal interest rates, with guaranteed annual audits, citizens' oversight and no money for school administrators' salaries?",P,"Yes: 139,814  No:  58,252",Yes: 70.58% No: 29.42%,55%,Bond Issue,S.F. Board of Education,November4_2003
1689,Labor,B,Retirement Benefits for Safety Employees,November,4,2003,04-Nov-03,Shall the City be authorized to amend its contract with the Public Employees Retirement System for retirement benefits for certain safety employees if the employees pay any increase in cost?,P,"Yes: 125,142  No:  62,103",Yes: 66.83% No: 33.17%,50%+1,Charter Amendment,Board of Supervisors,November4_2003
1690,Budget,C,City Services Auditor,November,4,2003,04-Nov-03,"Shall the Controller be required to monitor City services, audit City programs, and investigate complaints, and shall the City set aside at least 0.2% of the annual budget to fund these activities?",P,"Yes: 133,879  No:  55,819",Yes: 70.57% No: 29.43%,50%+1,Charter Amendment,Board of Supervisors,November4_2003
1691,Economy ,D,Small Business Commission,November,4,2003,04-Nov-03,"Shall the City be required to have a Small Business Commission to set policies affecting small businesses, with four members appointed by the Mayor and three members appointed by the Board of Supervisors?",P,"Yes: 104,922  No:  82,698",Yes: 55.92% No: 44.08%,50%+1,Charter Amendment,Board of Supervisors,November4_2003
1692,Elections,E,Ethics Reform,November,4,2003,04-Nov-03,"Shall the City consolidate its government ethics law in one code, amend some of those ethics laws, and create new ethics laws?",P,"Yes: 114,010  No:  70,045",Yes: 61.94% No: 38.06%,50%+1,Charter Amendment,Board of Supervisors,November4_2003
1693,Labor,F,Targeted Early Requirement,November,4,2003,04-Nov-03,Shall the City allow some of its employees to retire early if they are in job classifications where individual positions are being eliminated because of the City's budget shortfall?,P,"Yes: 128,112  No:  61,465",Yes: 67.57% No: 32.43%,50%+1,Charter Amendment,Board of Supervisors,November4_2003
1694,Budget,G,Rainy Day Fund,November,4,2003,04-Nov-03,"Shall the City create a ""rainy day"" fund for money collected when there is an unusually large surplus, and for use in years when there is a revenue shortfall?",P,"Yes: 146,004  No:  46,605",Yes: 75.80% No: 24.20%,50%+1,Charter Amendment,Board of Supervisors,November4_2003
1695,Public Safety,H,Police Commission/Office of Citizen Complaints,November,4,2003,04-Nov-03,"Shall the City increase the size of the Police Commission and change how its members are appointed, and shall the Office of Citizen Complaints be authorized to file charges against police officers with the Police Commission?",P,"Yes: 99,314    No:  91,900",Yes: 51.93% No: 48.07%,50%+1,Charter Amendment,Board of Supervisors,November4_2003
1696,Families,I,Child Care for Low Income Families,November,4,2003,04-Nov-03,Shall the City create a program to pay part of the cost of child care and preschool for families with income under a specified limit and with at least one child between three and five years old?,P,"Yes: 115,146  No:  77,256",Yes: 59.53% No: 40.47%,50%+1,Ordinance,Board of Supervisors,November4_2003
1697,Homeless,J,Facilities for the Homeless,November,4,2003,04-Nov-03,"Shall the City provide a temporary shelter for homeless seniors, youth, families and disabled individuals that is separate from the temporary shelter provided to the general homeless population?",P,"Yes: 113,564  No:  79,871",Yes: 58.70% No: 41.30%,50%+1,Ordinance,Initiative,November4_2003
1698,Taxes,K,Sales Tax for Transportation,November,4,2003,04-Nov-03,"Shall the City implement a 30-year New Transportation Expenditure Plan directing transportation sales tax funds to improved maintenance of local streets, transportation for the elderly and disabled, the Central Subway, a citywide network of fast and reliable buses, the Caltrain Extension to a new Transbay Terminal, improvements to pedestrian and bicycle safety and other projects and continue the existing half-cent sales tax during implementation of the New Transportation Expenditure Plan and future Plan updates?",P,"Yes: 142,042  No:  47,879",Yes: 74.79% No: 25.21%,66 2/3%,Ordinance,Board of Supervisors,November4_2003
1699,Labor,L,Minimum Wage,November,4,2003,04-Nov-03,Shall the City require employers to pay a minimum wage of $8.50 per hour (as adjusted for increases in the regional consumer price index) for work performed in San Francisco?,P,"Yes: 117,140  No:  79,498",Yes: 59.57% No: 40.43%,50%+1,Ordinance,Initiative,November4_2003
1700,Advertisement,M,Aggressive Solicitation Ban,November,4,2003,04-Nov-03,"Shall the City replace its anti-begging and aggressive solicitation laws with a new, more specific law that bans solicitation in certain public places and aggressive solicitation in all public places?",P,"Yes: 117,405  No:  79,375",Yes: 59.66% No: 40.34%,50%+1,Ordinance,Initiative,November4_2003
1701,Civil Rights,N,Taxi Permit Holder Disability,November,4,2003,04-Nov-03,"Shall the City be prohibited from taking away a taxi permit if the permit holder is unable, because of a disability, to drive the taxi the minimum number of hours or shifts per year?",F,"Yes: 52,326    No: 134,465",Yes: 28.01% No: 71.99%,50%+1,Ordinance,Board of Supervisors,November4_2003
1702,Taxes,A,Deferred Taxation Plan,March,2,2004,02-Mar-04,Shall City employees who receive a cash payment for unused vacation time and sick leave be permitted to defer this payment and defer state and federal taxes on this payment?,P,"Yes: 107,690  No: 64,943",Yes: 62.38%  No: 37.62%,50%+1,Charter Amendment,Board of Supervisors,March2_2004
1703,Labor,B,"Retirement Benefits for Public Defenders, District Attorneys, and Investigators",March,2,2004,02-Mar-04,"May the City contract with the California Public Employee Retirement System for retirement benefits for District Attorneys, Public Defenders and Public Defenders investigators if there is no change in cost to the City?",P,"Yes: 114,209  No: 54,418",Yes: 67.73%  No: 32.27%,50%+1,Charter Amendment,Board of Supervisors,March2_2004
1704,Public Safety,C,Civilian Jobs in the Police Department,March,2,2004,02-Mar-04,Shall the City reduce the required number of uniformed Police officers if the City fills certain positions currently performed by uniformed officers with civilian staff?,P,"Yes: 105,005  No: 64,773",Yes: 61.85%  No: 38.15%,50%+1,Charter Amendment,Board of Supervisors,March2_2004
1705,Civil Rights,D,Equal Treatment of Domestic Partners,March,2,2004,02-Mar-04,"Shall domestic partners be allowed to register in the City, even if they live or work outside the City, and shall the City Employees' Retirement System treat domestic partners as spouses?",P,"Yes: 113,646  No: 60,999",Yes: 65.07%  No: 34.93%,50%+1,Charter Amendment,Board of Supervisors,March2_2004
1706,Government,E,Requests for City Records Containing Private Information,March,2,2004,02-Mar-04,"Shall the Board of Supervisors, rather than individual departments and officials, respond to requests made by the federal or state government for records that may contain private information about citizens?",P,"Yes: 87,704    No: 80,236",Yes: 52.22%  No: 47.78%,50%+1,Charter Amendment,Board of Supervisors,March2_2004
1707,Public Safety,F,Labor Negotiations with Deputy Sheriffs,March,2,2004,02-Mar-04,Shall the rules that apply to labor negotiations with the uniformed members of the Police and Fire departments also apply to labor negotiations with the deputy sheriffs?,P,"Yes: 103,327  No: 60,267",Yes: 63.16%  No: 36.84%,50%+1,Charter Amendment,Board of Supervisors,March2_2004
1708,Public Safety,G,Supplemental Pay for City Employees on Military Duty,March,2,2004,02-Mar-04,"May the City provide supplemental pay for more than 180 days to City employees called for military service, and may the City provide this pay retroactively?",P,"Yes: 99,726    No: 69,589",Yes: 58.90%  No: 41.10%,50%+1,Charter Amendment,Board of Supervisors,March2_2004
1709,Education,H,Public Education Fund,March,2,2004,02-Mar-04,Shall the City create a fund to increase the City's spending for public education over the next eleven years?,P,"Yes: 123,103  No: 50,837",Yes: 70.77%  No: 29.23%,50%+1,Charter Amendment,Board of Supervisors,March2_2004
1710,Transportation,I,Replacement of Diesel Buses,March,2,2004,02-Mar-04,"Shall Muni be required to replace diesel buses purchased before 1991, and shall any new Muni vehicles be required to meet the anti-pollution standards that apply to other City vehicles?",P,"Yes: 118,074  No: 56,864",Yes: 67.49%  No: 32.51%,50%+1,Ordinance,Board of Supervisors,March2_2004
1711,Housing,J,Incentive to Build Below-Market-Rate Housing,March,2,2004,02-Mar-04,Shall housing developments located downtown or along the central waterfront be subject to less-restrictive density and height rules than other housing developments if the developer builds and sells additional below-market rate housing?,F,"Yes: 52,028    No: 121,352",Yes: 30.01%  No: 69.99%,50%+1,Ordinance,Initiative,March2_2004
1712,Transportation,2,Regional Measure 2  Regional Traffic Relief Plan,March,2,2004,02-Mar-04,"Shall voters authorize a Regional Traffic Relief Plan that does the following: 1) Directs revenues generated through the collection of bridge tolls to provide the following projects: a) Expand and extend BART.  B) New Transbay commuter rail crossing south of the San Francisco-Oakland Bay Bridge.  C) Comprehensive Regional Express bus network.  D) New expanded ferry service.  E) Better connections between BART, buses, ferries, and rail.  2) Approves a one dollar ($1) toll increase effective July 1, 2004, on all toll bridges in the bay area, except the Golden Gate Bridge?",P,"Yes: 115,891  No: 53,214",Yes: 68.53%  No: 31.47%,50%+1,Regional Measure,Senate Bill 916 (Perata) 2003-2004 Session; Senate Select Committee on Bay Area Transportation,March2_2004
1713,Housing,A,Affordable Housing Bonds,November,2,2004,02-Nov-04,"Shall the City borrow $200,000,000 to buy, build or renovate supportive and affordable housing and assist low- and moderate-income individuals and households to buy a home?",F,"Yes: 209,259  No: 116,706",Yes: 64.20%  No: 35.80%,66 2/3%,Bond Issue,Board of Supervisors,November2_2004
1714,Preservation,B,Historical Preservation Bonds,November,2,2004,02-Nov-04,"Shall the City borrow $60,000,000 to buy, renovate or preserve historical resources owned by the City or the San Francisco Unified School District?",F,"Yes: 181,658  No: 134,896",Yes: 57.39%  No: 42.61%,66 2/3%,Bond Issue,Board of Supervisors,November2_2004
1715,Health,C,Health Service System,November,2,2004,02-Nov-04,"Shall the Health Service System be a separate City department, and shall the Health Service Board be authorized to appoint and remove the manager of the Health Service System?",P,"Yes: 166,651  No: 129,210",Yes: 56.33%  No: 43.67%,50%+1,Charter Amendment,Board of Supervisors,November2_2004
1716,Elections,D,Changes to City Charter,November,2,2004,02-Nov-04,"Shall Charter rules be changed concerning the deadlines and number of votes required for action by the Board of Supervisors, the number of aides per Board member, and the length of time the commissioners may serve after their term has expired?",F,"Yes: 118,123  No: 162,385",Yes: 42.11%  No: 57.89%,50%+1,Charter Amendment,Board of Supervisors,November2_2004
1717,Public Safety,E,Police and Fire Survivor Benefits,November,2,2004,02-Nov-04,Shall the City pay the survivor of a police officer or firefighter who dies in the line of duty 100% of retirement benefits the officer or firefighter would have received?,P,"Yes: 210,091  No: 108,193",Yes: 66.01%  No: 33.99%,50%+1,Charter Amendment,Board of Supervisors,November2_2004
1718,Elections,F,Noncitizen Voting in School Board Elections,November,2,2004,02-Nov-04,"May San Francisco residents who are 18 or older vote in School Board elections, whether or not the resident is a United States citizen, if the resident is a parent, guardian or care-giver of a child in the School District?",F,"Yes: 155,643  No: 164,924",Yes: 48.55%  No: 51.45%,50%+1,Charter Amendment,Board of Supervisors,November2_2004
1719,Health,G,Health Plans for City Residents,November,2,2004,02-Nov-04,Shall the City authorize the Health Service Board to establish health plans for City residents?,P,"Yes: 201674  No: 100,206",Yes: 66.81%  No: 33.19%,50%+1,Charter Amendment,Board of Supervisors,November2_2004
1720,Entertainment,H,Naming the Stadium at Candlestick Point,November,2,2004,02-Nov-04,"Shall the City-owned sports stadium at Candlestick Point be named ""Candlestick Park?""",P,"Yes: 170,217  No: 141,904",Yes: 54.54%  No: 45.46%,50%+1,Ordinance,Board of Supervisors,November2_2004
1721,Economy ,I,Economic Analysis of Legislation,November,2,2004,02-Nov-04,"Shall the City hire economists to study proposed legislation and report on the likely impact on the local economy, and shall the City develop a long-term Economic Development Plan?",P,"Yes: 154,022  No: 142,650",Yes: 51.92%  No: 48.08%,50%+1,Ordinance,Board of Supervisors,November2_2004
1722,Taxes,J,Sales Tax Increase,November,2,2004,02-Nov-04,Shall the City increase the local sales tax by 1/4% (one-quarter-of-one-percent)?,F,"Yes: 131,529  No: 182,477",Yes: 41.89%  No: 58.11%,50%+1,Ordinance,Board of Supervisors,November2_2004
1725,Taxes,K,Business Tax,November,2,2004,02-Nov-04,"Shall the City create a temporary 0.1% (one-tenth-of-one-percent) gross receipts tax, and clarify how the City's existing payroll expense tax applies to certain business entities?",F,"Yes: 135,068  No: 162,910",Yes: 45.33%  No: 54.67%,50%+1,Ordinance,Board of Supervisors,November2_2004
1726,Taxes,L,Use of Hotel Tax to Preserve Movie Theaters,November,2,2004,02-Nov-04,"Shall 15% of the existing hotel tax surcharge be set aside to acquire, preserve and maintain neighborhood and single-screen movie theaters and promote the local film-making industry?",F,"Yes: 78,157   No: 229,487",Yes: 25.41%  No: 74.59%,66 2/3%,Ordinance,Initiative,November2_2004
1727,N/A,M,This measure was withdrawn,November,2,2004,02-Nov-04,,,,,,Withdrawn,Withdrawn,November2_2004
1728,Military,N,Withdrawing U.S. Military Personnel from Iraq,November,2,2004,02-Nov-04,Shall it be City policy to urge the United States government to withdraw all troops from Iraq and bring all military personnel in Iraq back to the United States?,P,"Yes: 195,257  No: 113,053",Yes: 63.33%  No: 36.67%,50%+1,Policy Declaration,Board of Supervisors,November2_2004
1729,Taxes,O,Use of Sales Tax Funds,November,2,2004,02-Nov-04,"Shall it be City policy to use additional sales tax funds resulting from approval of Proposition J to assist low-income residents including seniors, the disabled, children and the homeless?",P,"Yes: 181,340  No: 122,644",Yes: 59.65%  No: 40.35%,50%+1,Policy Declaration,Board of Supervisors,November2_2004
1730,Transportation,AA,BART Earthquake Safety Bond,November,2,2004,02-Nov-04,"To protect public safety and keep Bay Area traffic moving in the aftermath of an earthquake or other disaster, shall BART, the San Francisco Bay Area Rapid Transit District, be authorized to issue bonds not to exceed $980 million dollars to make earthquake safety improvements to BART facilities in Contra Costa, San Francisco, and Alameda Counties, including strengthening tunnels, bridges, overhead tracks and the underwater Transbay Tube, and establish and independent citizens; oversight committee to verify bond revenues are spent as promised?",P,"Yes: 224,297  No: 71,301",Yes: 75.88%  No: 24.12%,66 2/3%,Regional Bond Issue,,November2_2004
1731,Education,A,Community College District General Obligation Bonds,November,8,2005,08-Nov-05,"Shall San Francisco Community College District (City College) increase opportunities and improve conditions at its campuses throughout San Francisco by issuing $246,300,000 in Phase II bonds at legal interest rates to pay for capital improvements including increasing student access to advanced computer technology and bio/stem cell technology, renovating classrooms, building new facilities for upper division classes, neighborhood classes and the performing arts, with annual audits, citizens' oversight and no spending for college administrators' salaries?",P,"Yes: 134,999 No: 76,320",Yes: 63.88%  No: 36.12%,55%,Bond Issue,Community College District,November8_2005
1732,Infrastructure,B,Street and Sidewalk Improvement Bonds,November,8,2005,08-Nov-05,"Shall the City incur $208,000,000 of bonded indebtedness to finance street reconstruction, pavement, renovation, disabled access, curb ramp construction, sidewalk and street improvements, street structure rehabilitation and improvements, pedestrian safety street and signal improvements, street improvements for bicycle use and all other structures and improvements necessary or convenient for the foregoing purposes?",F,"Yes: 119,095 No: 91,952",Yes: 56.43%  No: 43.57%,66 2/3%,Bond Issue,Board of Supervisors,November8_2005
1733,Budget,C,Ethics Commission Budget and Outside Counsel,November,8,2005,08-Nov-05,"Shall the City create a new budget process for the Ethics Commission that alters the role of the Mayor, and authorize the Commission to hire outside consul under certain circumstances?",F,"Yes: 81,672  No: 120,968",Yes: 40.30%  No: 59.70%,50%+1,Charter amendment,Board of Supervisors,November8_2005
1734,Transportation,D,Appointment of Municipal Transportation Agency Board of Directors,November,8,2005,08-Nov-05,"Shall the President of the Board of Supervisors nominate three members and the Mayor nominate four members to the Municipal Transportation Agency Board of Directors, and shall the members be prevented from serving as ""hold-overs""?",P,"Yes: 71,585  No: 29,801",Yes: 64.84%  No: 35.16%,50%+1,Charter amendment,Board of Supervisors,November8_2005
1735,Elections,E,Election Date of the Assessor-Recorder and Public Defender,November,8,2005,08-Nov-05,Shall the election date of the Assessor-Recorder be moved from the Statewide Primary Election in June to the municipal election the following November?,P,"Yes: 138,765 No: 58,998",Yes  70.16%  No: 29.84%,50%+1,Charter amendment,Board of Supervisors,November8_2005
1736,Public Safety,F,Neighborhood Firehouses,November,8,2005,08-Nov-05,"Shall the City maintain and operate all 42 firehouses and specific emergency and rescue vehicles and equipment at the same levels that were used on January 1, 2004?",P,"Yes:119,581 No: 88,062",Yes: 57.58%  No: 42.42%,50%+1,Ordinance,Initiative,November8_2005
1737,Recreation,G,Access to Underground Parking at Golden Gate Park,November,8,2005,08-Nov-05,"May the underground parking garage in Golden Gate Park have one entrance-exit inside the Park without dedicated access lanes that lead outside the Park, and shall the number of lanes of automobile traffic in parts of the park be limited?",P,"Yes: 138,069 No: 65,862",Yes: 67.70%  No: 32.30%,50%+1,Ordinance,Board of Supervisors,November8_2005
1738,Public Safety,H,Firearm Ban,November,8,2005,08-Nov-05,"Shall the City ban the manufacture, distribution, sale and transfer of firearms and ammunition within San Francisco, and ban City residents from possessing handguns within San Francisco?",P,"Yes: 123,033 No: 89,856",Yes: 57.79%  No: 42.21%,50%+1,Ordinance,Board of Supervisors,November8_2005
1739,Education,I,"No Military Recruiters in Public Schools, Scholarships for Education and Job Training",November,8,2005,08-Nov-05,Shall it be City policy to oppose military recruiting in public schools and consider funding scholarships for education and training that could provide an alternative to military service?,P,"Yes: 125,581 No: 86,723",Yes: 70.9%    No: 29.1%,50%+1,Policy Declaration,Initiative,November8_2005
1740,Crime,A,Additional Funding for Homicide Prevention Services,June,6,2006,06-Jun-06,"Shall the City allocate an additional $10 million primarily from the City's General Fund for each of the next three fiscal years for violence prevention and intervention services, establish a Homicide Prevention Planning Council to develop and annually revise a Homicide Prevention Plan and create a Survivors' Fund in the Office of the District Attorney?",F,"Yes: 66,982 No: 69,060",Yes: 49.24% No: 50.76%,50%+1,Charter Amendment,Board of Supervisors,June6_2006
1741,Housing,B,Eviction Disclosure Ordinance,June,6,2006,06-Jun-06,Shall the City change its laws to require landlords who offer to sell buildings of two or more residential units to disclose to all potential buyers the specific legal grounds for any evictions that result in vacant units at the time of sale and whether the evicted tenants were elderly or disabled?,P,"Yes: 71,440 No: 65,373",Yes: 52.22% No: 47.78%,50%+1,Ordinance,Board of Supervisors,June6_2006
1742,Elected Officials,C,Appointing Elected Officials to the Transbay Joint Powers Authority,June,6,2006,06-Jun-06,Shall the City change the appointment process for the City's three representatives to the Transbay Joint Powers Authority by specifically designating the Mayor and two members of the Board of Supervisors to represent the City?,F,"Yes: 37,030 No: 93,905",Yes: 28.28% No: 71.72%,50%+1,Ordinance,Board of Supervisors,June6_2006
