ID,ISSUE,PROPLetter,PROPTitle,Month,Day,Year,Date,Description,PASS_FAIL,Vote_Counts,Percent_Vote,Percent_Required_To_Pass,Kind,HowPlaced,Fullimage
1743,Hospital,D,Zoning Changes to Limit Services at Laguna Honda Hospital and Other Residential Health Care Facilities,June,6,2006,06-Jun-06,"Shall the City amend the Planning Code to create the Laguna Honda Hospital Special Use District"" that includes the site of Laguna Honda Hospital, limit the patients who can receive services at Laguna Honda Hospital and certain other residential health care facilities, and allow both publicly and privately-owned residential health care facilities in ""public"" districts throughout San Francisco?",F,"Yes: 35,418 No: 99,060",Yes: 26.34% No: 73.66%,50%+1,Ordinance,Initiative,June6_2006
1775,Education,A,School Bonds,November,7,2006,07-Nov-06,"Shall the San Francisco Unified School District modernize and repair up to 64 additional school facilities to health, safety instructional and accessibility standards, and where applicable, replace portable trailer with permanent classrooms: upgrade bathrooms,science labs, plumbing, electrical and other building systems: replace heating and ventilation systems; and renovate classrooms, with proceeds from the issuance of up to $450,000,000 in bonds, at legal interest rates, with guaranteed annual audits, and citizens' oversight to monitor expenditures?",P,"Yes: 171,236 No: 60,460",Yes: 73.85% No: 25.15%,55%+1,Bond Issue,,November7_2006
1776,Elected Officials,B,Allowing Members of Boards and Commissions to Participate in Meetings by Teleconference due to Pregnancy and Related Conditions; Adoption of Parental Leave Policies,November,7,2006,07-Nov-06,"Shall the Board of Supervisors adopt a parental leave policy that permits its members and members of all City boards and commissions to participate in meetings by teleconference when the member is not able to attend due to pregnancy, child birth or related condition?",P,"Yes: 164,166 No: 63,157",Yes: 72.22% No: 27.78%,50%+1,Charter Amendment,,November7_2006
1777,Elected Officials,C,Setting Salaries of Certain Local Elected Officials,November,7,2006,07-Nov-06,"Shall the Civil Service Commission set the salaries of the Mayor, City Attorney, District Attorney, Public Defender, Assessor-Recorder, Treasurer, and Sheriff based on the average salary paid to comparable officials in other Bay Area counties?",P,"Yes: 140,561 No: 81,396",Yes: 63.33% No: 36.67%,50%+1,Charter Amendment,,November7_2006
1778,Public Service,D,Disclosure of Private Information,November,7,2006,07-Nov-06,Shall the City and County's contractors be prohibited from disclosing private information about individuals except under limited circumstances?,P,"Yes: 143,020 No: 79,230",Yes: 64.35% No: 35.65%,50%+1,Ordinance,,November7_2006
1779,Transportation,E,Parking Tax Ordinance,November,7,2006,07-Nov-06,Shall the City's parking tax be increased from 25 percent to 35 percent and apply to valet parking services even if the valet company does not pay for the property where it parks?,F,"Yes: 73,922   No:151,628",Yes: 32.77% No: 67.23%,50%+1,Ordinance,,November7_2006
1780,Public Service,F,Paid Sick Leave Ordinance,November,7,2006,07-Nov-06,Shall employers be required to provide sick leave to their employees working in San Francisco?,P,"Yes: 139,005 No: 89,057",Yes: 60.95% No: 39.05%,50%+1,Ordinance,,November7_2006
1781,Economy,G,Limitations on Formula Retail Stores,November,7,2006,07-Nov-06,Shall formula retail use stores be required to get a conditional use authorization from the Planning Commission before opening in any Neighborhood Commercial District where formula retail use is currently permitted?,P,"Yes: 125,728 No: 90,353",Yes: 58.19% No: 41.81%,50%+1,Ordinance,,November7_2006
1782,Housing,H,Relocation Assistance for No Fault Tenant Removal,November,7,2006,07-Nov-06,Shall landlords be required to provide relocation payments to eligible residential tenants who are evicted through no fault of their own?,P,"Yes: 120,916 No: 107,541",Yes: 52.93% No: 47.07%,50%+1,Ordinance,,November7_2006
1783,Elected Officials,I,Adopting a Policy that the Mayor Appear Monthly at a Board of Supervisors Meeting,November,7,2006,07-Nov-06,Shall it be City policy to urge the Mayor to appear in person at one regularly scheduled meeting of the Board of Supervisors each month to engage in formal policy discussions with the members of the Board?,P,"Yes: 126,023 No: 97,567",Yes: 56.36% No: 43.64%,50%+1,Policy Declaration,,November7_2006
1784,Government,J,Adopting a Policy Calling for the Impeachment of President Bush and Vice President Cheney,November,7,2006,07-Nov-06,Shall it be City policy to call for the impeachment of President Bush and Vice President Cheney?,P,"Yes: 133,042 No: 94,282",Yes: 58.53% No: 41.47%,50%+1,Policy Declaration,,November7_2006
1785,Housing,K,Adopting a Policy Relating to the Housing Needs of Seniors and Disabled Adults,November,7,2006,07-Nov-06,Shall it be City policy to acknowledge the particular housing needs of seniors and disabled adults with limited financial resources and to explore ways of addressing these needs?,P,"Yes: 161,384 No: 65,073",Yes: 71.30% No: 28.70%,50%+1,Policy Declaration,,November7_2006
1786,Transportation,A,"Transit Reform, Parking Regulation and Emissions Reduction",November,6,2007,06-Nov-07,"Shall the Municipal Transportation Agency be provided greater governing authority, and additional funding, and be required to develop a Climate Action Plan, and shall the City not increase the maximum number of parking spaces allowed for new private development projects unless approved by a super-majority of the Board?",P,"Yes:  80,786  No: 64,346",Yes: 55.66% No: 44.34%,50%+1,Charter Amendment,,November6_2007
1787,Government,B,Limiting Hold-Over Service on Charter-Created Boards and Commissions,November,6,2007,06-Nov-07,Shall members of Charter-created boards and commissions be prohibited from serving as hold-overs for more than 60 days after their term expires?,P,"Yes:  96,034  No: 38,915",Yes: 71.16% No: 28.84%,50%+1,Charter Amendment,,November6_2007
1788,Elections,C,Requiring Public Hearings on Proposed Measures,November,6,2007,06-Nov-07,Shall the Mayor or four or more members of the Board of Supervisors who wish to place a measure on the ballot first be required to submit it to the Board of Supervisors for a public hearing?,P,"Yes:  94,939  No: 44,258",Yes: 68.20% No: 31.80%,50%+1,Charter Amendment,,November6_2007
1789,Government,D,Renewing Library Preservation Fund,November,6,2007,06-Nov-07,Shall the Library Preservation Fund be renewed and its purpose expanded so that the Fund can be used to repay debt issued by the City to construct and improve library facilities?,P,"Yes: 105,328 No: 36,102",Yes: 74.47% No: 25.53%,50%+1,Charter Amendment,,November6_2007
1790,Elected Officials,E,Requiring Mayor to Appear Monthly at a Board of Supervisors Meeting,November,6,2007,06-Nov-07,Shall the Mayor be required to appear in person at one regularly scheduled meeting of the Board of Supervisors each month to engage in formal policy discussions with members of the Board?,F,"Yes:  70,166  No: 74,253",Yes: 48.59% No: 51.41%,50%+1,Charter Amendment,,November6_2007
1791,Public Safety,F,Authorizing the Board of Supervisors to Amend Contract for Retirement Benefits for Police Department Employees Who Were Airport Police Officers,November,6,2007,06-Nov-07,"Shall the Board of Supervisors be granted the authority to amend the City's contract with the California Public Employees' Retirement System (CalPERS) to allow police department employees who served as airport police officers before December 27, 1997 to end their participation in CalPERS and move their service credit to the San Francisco Employees' Retirement System?",P,"Yes:  69,637  No: 65,321",Yes: 51.60% No: 48.40%,50%+1,Charter Amendment,,November6_2007
1792,Recreation,G,Establishing Golden Gate Park Stables Matching Fund,November,6,2007,06-Nov-07,"Shall the City establish a Golden Gate Park Stable Matching Fund to be used for renovation, repair and maintenance of the Golden Gate Park stables and provide up to $750,000 in matching City revenues toward this fund?",P,"Yes:  77,340  No: 62,331",Yes: 55.37% No: 44.63%,50%+1,Ordinance,,November6_2007
1793,Transportation,H,Regulating Parking Spaces,November,6,2007,06-Nov-07,Shall the Planning Code be changed to increase the number of parking spaces that developers are permitted to build and ease restrictions on building new parking spaces for residential and non-residential buildings?,F,"Yes:  46,632  No: 94,277",Yes: 33.09% No: 66.91%,50%+1,Ordinance,,November6_2007
1794,Business,I,Establishing Office of Small Business as City Department and Creating Small Business Assistance Center,November,6,2007,06-Nov-07,"Shall the City establish the Office of Small Business as a City department, require it to operate a Small Business Assistance Center, providing a central source of information for small businesses, and allocate $750,000 for its first year of operations?",P,"Yes:  80,865  No: 55,855",Yes: 59.15% No: 40.85%,50%+1,Ordinance,,November6_2007
1795,Infrastructure ,J,Adopting a Policy to Offer Free City-Wide Wireless High-Speed Internet Network,November,6,2007,06-Nov-07,"Shall it be City policy that the City should, through an agreement with a private provider, offer free wireless high-speed internet access as quickly as possible on an equal basis to all parts of San Francisco?",P,"Yes:  86,451  No: 52,428",Yes: 62.25% No: 37.75%,50%+1,Policy Declaration,,November6_2007
1796,Advertising,K,Adopting a Policy to Restrict Advertising on Street Furniture and City Buildings,November,6,2007,06-Nov-07,Shall it be City policy that the City should not increase the number of general advertising signs on street furniture and City-owned buildings?,P,"Yes:  86,250  No: 53,195",Yes: 61.85% No: 38.15%,50%+1,Policy Declaration,,November6_2007
1797,Recreation,A,"Clean and Safe Neighborhood Parks Bonds, 2008",February,5,2008,05-Feb-08,"Shall the City incur $185,000,000 of bonded indebtedness to fund certain costs associated with the construction, reconstruction, purchase and/or improvement of the park and recreation facilities located within the City, under the jurisdiction of the Recreation Park Commission or under the jurisdiction of the Port Commission as further described in Section 3 of the ordinance placing this measure onto the ballot, and paying other costs necessary and convenient for effectuating those purposes, including costs connected with or incidental to the authorization, issuance and sale of the bonds; and authorizing landlords to pass-through to residential tenants in units subject to Chapter 37 of the San Francisco Administrative Code (the ""Residential Stabilization and Arbitration Ordinance"") 50% of the increase in the real property taxes attributable to the cost of the repayment of the bonds?",P,"Yes: 177,194 No: 71,232",Yes: 71.33% No: 28.67%,66 2/3%,Bond Issue,,February5_2008
1798,Public Safety,B,Creating a New Deferred Retirement Option Program for Members of the San Francisco Police Department,February,5,2008,05-Feb-08,Shall the City allow certain retirement-eligible police officers to continue working for up to three additional years while accumulating their regular retirement benefits in tax deferred retirement accounts?,P,"Yes: 158,883 No: 86,613",Yes: 64.72% No: 35.28%,50%+1,Charter Amendment,,February5_2008
1799,Museum ,C,Adopting a Policy that the City Acquire Alcatraz Island to Make It a Global Peace Center,February,5,2008,05-Feb-08,Shall it be City policy that the City should explore and facilitate the acquisition of Alcatraz Island from the United States government to transform it into a Global Peace Center?,F,"Yes: 69,251  No: 177,301",Yes: 28.09% No: 71.91%,50%+1,Policy Declaration,,February5_2008
1800,Education,A,School Parcel Tax,June,3,2008,03-Jun-08,"To enhance quality educational programs for children; attract and retain quality teachers and staff by increasing salaries; provide teachers with additional compensation for extra work at hard-to-staff schools and in hard-to-fill subject areas; and increase teacher training, resources and classroom support, technology, innovation, and accountability, shall the San Francisco Unified School District be authorized to levy $198 per parcel annually, adjusted for inflation, with mandatory citizen oversight?",P,"Yes: 113,999 No: 51,273",Yes: 68.98% No:  31.02%,66 2/3%,Parcel Tax Measure,,June3_2008
1801,Health Care,B,Changing Qualifications for Retiree Health and Pension Benefits and Establishing a Retiree Health Care Trust Fund,June,3,2008,03-Jun-08,"Shall the City increase the years of service required for new City employees and certain employees of the School District, the Superior Court and the Community College District to qualify for employer-funded retiree health benefits, establish a separate Retiree Health Care Trust Fund to fund retiree health care costs, and increase retirement benefits and retirement cost-of-living adjustments for certain City employees?",P,"Yes:  118,729 No: 41,598",Yes: 74.05% No:  25.95%,50%+1,Charter Amendment,,June3_2008
1802,Government,C,Forfeiture of Retirement Benefits for Conviction of a Crime Involving Moral Turpitude in Connection with City Employment,June,3,2008,03-Jun-08,Shall the City prohibit San Francisco Employees' Retirement System members who are convicted of a crime involving moral turpitude in connection with their employment from receiving and retirement benefits funded with employer contributions,P,"Yes:   91,924 No:  66,379",Yes:  58.07% No:  41.93%,50%+1,Charter Amendment,,June3_2008
1803,Government,D,Appointment to City Boards and Commissions,June,3,2008,03-Jun-08,"Shall it be City policy that the membership of City boards and commissions reflect the interests and contributions of both men and women of all races, ethnicities, sexual orientations and types of disabilities and that City officers and agencies support the nomination, appointment or confirmation of female, minority and disabled candidates to fill seats on these bodies?",P,"Yes:   91,642 No:   63,681",Yes:  59.00%       No:  41.00%,50%+1,Charter Amendment,,June3_2008
1804,Elected Officials,E,Requiring Board of Supervisors' Approval of Mayor's Appointments to the Public Utilities Commission and Creating Qualifications for Commission Members,June,3,2008,03-Jun-08,Shall the City set qualifications for members of the Public Utilities Commission (PUC) and change the process for appointing members to the PUC by requiring a majority of the Board of Supervisors to approve the Mayor's appointments to the PUC?,P,"Yes:   80,489  No:   74,916",Yes:  51.79%      No:   48.21%,50%+1,Charter Amendment,,June3_2008
1805,Housing,F,Affordable Housing Requirement for the Candlestick Point and Hunters Point Shipyard Mixed-Use Development Project,June,3,2008,03-Jun-08,"Shall it be City policy that any mixed-use development plan the City approves for Candlestick Point and Hunters Point Shipyard require 50% of all new housing units developed in the area be affordable, give preferences for the rental or purchase of new affordable housing to families of low and moderate income, and, if Alice Griffin housing is rebuilt, replace the units on a one-to-one basis; and shall the City be prohibited from selling, conveying or leasing any City-owned land at Candlestick Point unless the Board of Supervisors finds that the mixed-use development plan for the area incorporated these policies?",F,"Yes:    58,756 No: 101,112",Yes:   36.75%     No:   63.25%,50%+1,Ordinance,,June3_2008
1806,Recreation,G,Mixed-Use Development Project for Candlestick Point and Hunters Point Shipyard,June,3,2008,03-Jun-08,"Shall it be City policy to encourage timely development of a mixed-use project in the Bayview on Candlestick Point and Hunters Point Shipyard, including a new 49ers stadium or a non-stadium alternative; shall the City be authorized to transfer park land in Candlestick Point for non-recreational use if the land is replaced with new public parks or open spaces of at least equal size and the transfer meets the measure's policy objectives; and shall Propositions D and F, approved by the voters in June 1997, be repealed?",P,"Yes:     99,008 No:  59,423",Yes:    62.49%    No:   37.51%,50%+1,Ordinance,,June3_2008
1807,Elected Officials,H,"Prohibiting Elected Officials, Candidates, or Committees They Control from Soliciting or Accepting Contributions from Certain City Contractors",June,3,2008,03-Jun-08,"Shall it be unlawful for City elected officials, candidates or political committees they control to solicit or accept campaign contributions from contractors who are prohibited from making contributions to these elected officials, candidates and political committees because the contractor has a pending contract or a recently approved contract before the official or the Board on which the official or an appointee of the official sits?",P,"Yes:   104,012 No:   50,865",Yes:    67.16%    No:   32.84%,50%+1,Ordinance,,June3_2008
1808,Hospital,A,"San Francisco General Hospital and Trauma Center Earthquake Safety Bonds, 2008",November,4,2008,04-Nov-08,"To ensure the availability of San Francisco General Hospital and Trauma Center in the event of a natural disaster or emergency, by building and/or rebuilding and improving the earthquake safety of the hospital and to pay related costs necessary or convenient for the foregoing purposes, shall the City and County of San Francisco issue $887,400,000 in general obligation bonds subject to independent oversight and regular audits?",P,"Yes:   300,595 No:   58,049",Yes:    83.81%    No:   16.19%,66 2/3%,Bond Issue,,November4_2008
1809,Housing,B,Establishing Affordable Housing Fund,November,4,2008,04-Nov-08,"Shall the City establish an Affordable Housing Fund; set aside from the property tax 2 1/2 cents for every $100 of assessed value for this Fund through 2024; and use this Fund subject to public review, to acquire and develop new affordable housing units meeting certain priorities and income limitations?",F,"Yes:   166,299 No: 181,534",Yes:    47.81%    No:   52.19%,50%+1,Charter Amendment,,November4_2008
1810,Government,C,Prohibiting City Employees from Serving on Charter Boards and Commissions,November,4,2008,04-Nov-08,Shall the City prohibit City employees from serving on most Charter created boards and commissions?,F,"Yes:   124,395 No: 202,419",Yes:    38.06%    No:   61.94%,50%+1,Charter Amendment,,November4_2008
1811,Waterfront,D,Financing Pier 70 Waterfront District Development Plan upon Board of Supervisors' Approval,November,4,2008,04-Nov-08,"Shall the City provide funds to develop Pier 70, based on new City hotel and payroll expenses tax revenues from the development, if the Board of Supervisors approves a financial and land use plan for Pier 70?",P,"Yes:   226,513 No:  106,228",Yes:    68.07%    No:  31.93%,50%+1,Charter Amendment,,November4_2008
1812,Elections,E,Changing the Number of Signatures to Recall City Officials,November,4,2008,04-Nov-08,Shall the City adopt state law signature requirements for petitions to recall City officials?,P,"Yes:   195,605 No:  129,862",Yes:    60.10%    No:  39.90%,50%+1,Charter Amendment,,November4_2008
1813,Elections,F,Holding All Scheduled City Elections Only in Even-Numbered Years,November,4,2008,04-Nov-08,Shall the City shift all City elections except special elections to even-numbered years after the November 2011 election?,F,"Yes:   144,592 No:  176,692",Yes:    45.00%    No:  55.00%,50%+1,Charter Amendment,,November4_2008
1814,Government,G,Allowing Retirement System Credit for Unpaid Parental Leave,November,4,2008,04-Nov-08,"Shall the City allow City employees to purchase retirement system credit for unpaid parental leave taken before July 1, 2003, as long as the purchase price covers all City costs?",P,"Yes:   202,011 No:  121,354",Yes:    62.47%     No:  37.53%,50%+1,Charter Amendment,,November4_2008
1815,Clean Energy,H,Setting Clean Energy Deadlines; Studying Options for Providing Energy: Changing Revenue Bond Authority to Pay for Public Utility Facilities,November,4,2008,04-Nov-08,"Shall the City: evaluate making the City the primary provider of electric power in San Francisco; consider options to provide energy to San Francisco residents, businesses and City departments; mandate deadlines for the City to meet its energy needs through clean and renewable energy sources; establish a new Office of the Independent Ratepayer Advocate to make recommendations about utility rates to the City's Public Utilities Commission; and allow the Board of Supervisors to approve the issuance of revenue bonds to pay for any public utility facilities without voter approval?",F,"Yes:   133,214 No:  211,681",Yes:    38.65%     No:  61.35%,50%+1,Charter Amendment,,November4_2008
1816,Public Utilities,I,Creating the Office of an Independent Rate Payer Advocate,November,4,2008,04-Nov-08,Shall the City create an Office of the Independent Ratepayer Advocate to make recommendations about utility rates to the City's Public Utilities Commission?,F,"Yes:   117,050 No:   201,811",Yes:    36.71%     No:  63.29%,50%+1,Charter Amendment,,November4_2008
1817,Arts,J,Creating a Historic Preservation Commission,November,4,2008,04-Nov-08,Shall the City establish a seven-member Historic Preservation Commission and give it authority over historic preservation-related decisions in the City?,P,"Yes:   183,372 No:   146,194",Yes:     55.64%    No: 44.36%,50%+1,Charter Amendment,,November4_2008
1818,Judicial ,K,Changing the Enforcement Laws Related to Prostitution and Sex Workers,November,4,2008,04-Nov-08,"Shall the City: stop enforcing laws against prostitution; stop funding or supporting the First Offender Prostitution Program or any similar anti-prostitution program; enforce existing criminal laws that prohibit crimes such as battery, extortion and rape, regardless of the victim's status as a sex worker; and fully disclose the investigation and prosecution of violent crimes against sex workers?",F,"Yes:   140,185  No:   202,235",Yes:     40.94%    No: 59.06%,50%+1,Ordinance,,November4_2008
1819,Judicial ,L,Funding the Community Justice Center,November,4,2008,04-Nov-08,"Shall the City guarantee that the City provide first-year funding for the Community Justice Center, authorize the Director of Property to lease space for the CJC, and define the CJC's scope and operations?",F,"Yes:   132,097  No:   178,440",Yes:      42.54%   No:  57.46%,50%+1,Ordinance,,November4_2008
1820,Housing,M,Changing the Residential Rent Ordinance to Prohibit Specific Acts of Harassment of Tenants by Landlords,November,4,2008,04-Nov-08,"Shall the City's Residential Rent Ordinance be amended to prohibit specific acts of tenant harassment by landlords and to provide for enforcement by means of court orders, rent reduction, monetary awards or criminal penalties?",P,"Yes:   195,023  No:   136,416",Yes:      58.84%   No:  41.16%,50%+1,Ordinance,,November4_2008
1821,Taxes,N,Changing Real Property Transfer Tax Rates,November,4,2008,04-Nov-08,Shall the City increase its transfer tax on sales of real estate worth more than $5 million to 1.5% and reduce the tax by up to 1/3 on sales of residences where the seller installed solar energy systems or made seismic safety improvements?,P,"Yes:   223,808  No:    102,621",Yes:      86.56%   No:  13.44%,50%+1,Ordinance,,November4_2008
1822,Taxes,O,Replacing the Emergency Response Fee with an Access Line Tax and Revising the Telephone Users Tax,November,4,2008,04-Nov-08,"Shall the City replace the Emergency Response Fee with an Access Line Tax at the same rates and with the same exemptions, and revise the Telephone Users Tax?",P,"Yes:   208,044  No:    103,679",Yes:      66.74%   No:  33.25%,50%+1,Ordinance,,November4_2008
1823,Transportation,P,Changing the Composition of the San Francisco County Transportation Authority Board,November,4,2008,04-Nov-08,"Shall the City change the size and composition of the Transportation Authority Board and encourage the Authority to use City agencies and departments to perform staff functions, to obtain expert financial review before adopting Authority budgets, and to adopt the same ethics and public records laws that apply to City agencies?",F,"Yes:   101,230  No:    205,665",Yes:      32.99%   No:  67.01%,50%+1,Ordinance,,November4_2008
1824,Taxes,Q,Modifying the Payroll Expense Tax,November,4,2008,04-Nov-08,"Shall the City specify that certain partnerships and other businesses are subject to the City's payroll expense tax and expand the payroll expense tax exemption for small businesses so that businesses with annual payroll expenses of $250,000 or less would not have to pay the tax?",P,"Yes:   233,411  No:      81,178",Yes:       74.20%  No:  25.80%,50%+1,Ordinance,,November4_2008
1825,Infrastructure ,R,Renaming the Oceanside Water Treatment Plant,November,4,2008,04-Nov-08,Shall the City change the name of the Oceanside Water Pollution Control Plant to the George W. Bush Sewage Plant?,F,"Yes:   101,376  No:    233,733",Yes:       30.25%  No:  69.75%,50%+1,Ordinance,,November4_2008
1826,Finance,S,Policy Regarding Budget Sey-Asides and Identification of Replacement Funds,November,4,2008,04-Nov-08,"Shall it be City policy that the voters will not approve any new set-aside of City revenue unless the set-aside identifies a new funding source, includes limits on annual increases, and automatically expires after 10 years?",P,"Yes:   167,974  No:     133,817",Yes:       55.66%  No:  44.34%,50%+1,Ordinance,,November4_2008
1827,Government,T,Free and Low-Cost Substance Abuse Treatment Programs,November,4,2008,04-Nov-08,Shall the City be required to provide enough free and low-cost substance abuse treatment services to meet demand and to maintain funding for such services?,P,"Yes:   200,649  No:     127,014",Yes:        61.24% No:  38.76%,50%+1,Ordinance,,November4_2008
